{
  "casos": [
    {
      "adjudicacoes": "config/adjudicacoes.json",
      "case_id": "preparo_direto_completo",
      "conjunto": "desenvolvimento",
      "descricao": "Controle positivo: preparo direto com sete recibos completos.",
      "gabarito": "gabaritos/preparo_direto_completo.json",
      "origem": {
        "referencias_s023": [],
        "tipo": "sintetico"
      },
      "rollout": "rollouts/preparo_direto_completo.jsonl",
      "sha256_adjudicacoes": "f707d0aeaf54f0c82de372ec2d46a97393ff0a1417ddf237404cf124ace043e8",
      "sha256_gabarito": "76b3e6b8ca370ecc4bd12f2474f3cca7132d2a8738d280e4cc9361f1eb961343",
      "sha256_rollout": "42792755fc91cb08259bece50e7c6a967745850ecbaaaa89b66650a28397aa63",
      "tags": [
        "controle"
      ]
    },
    {
      "adjudicacoes": "config/adjudicacoes.json",
      "case_id": "leitura_e_preparo_separados",
      "conjunto": "desenvolvimento",
      "descricao": "Leitura e preparo equivalentes em chamadas separadas.",
      "gabarito": "gabaritos/leitura_e_preparo_separados.json",
      "origem": {
        "referencias_s023": [],
        "tipo": "sintetico"
      },
      "rollout": "rollouts/leitura_e_preparo_separados.jsonl",
      "sha256_adjudicacoes": "f707d0aeaf54f0c82de372ec2d46a97393ff0a1417ddf237404cf124ace043e8",
      "sha256_gabarito": "6d167e2d0de2f542921f76967b7e16054afd0e6b325763dde2d7c592544887ae",
      "sha256_rollout": "b84cda05c63f858cda5415ce5c904c3ec9a2bd017ee984d2a0eeaaa446a4ae57",
      "tags": [
        "metamorfico",
        "controle"
      ]
    },
    {
      "adjudicacoes": "config/adjudicacoes.json",
      "case_id": "leitura_e_preparo_agrupados",
      "conjunto": "desenvolvimento",
      "descricao": "Redução sintética do agrupamento que descartou sete recibos na sessão 23.",
      "gabarito": "gabaritos/leitura_e_preparo_agrupados.json",
      "origem": {
        "referencias_s023": [
          "call_x1z7XqGYozos780kfjIJsj0H"
        ],
        "tipo": "reducao_s023"
      },
      "rollout": "rollouts/leitura_e_preparo_agrupados.jsonl",
      "sha256_adjudicacoes": "f707d0aeaf54f0c82de372ec2d46a97393ff0a1417ddf237404cf124ace043e8",
      "sha256_gabarito": "f1ad1eeda30a3d2ddac0f84c423aff69fb021c0242f0e764cac21e670a7d244a",
      "sha256_rollout": "546528801db2edecd74b4644cd4965cbbe3ed14fc82f3bb799138a25634fdaf4",
      "tags": [
        "metamorfico",
        "s023"
      ]
    },
    {
      "adjudicacoes": "config/adjudicacoes.json",
      "case_id": "consulta_sucesso_preparo_falha",
      "conjunto": "desenvolvimento",
      "descricao": "Consulta bem-sucedida e preparo falho com resultados permutados.",
      "gabarito": "gabaritos/consulta_sucesso_preparo_falha.json",
      "origem": {
        "referencias_s023": [
          "call_GWDmUBmgUOS5GB4p7lJNzijy"
        ],
        "tipo": "reducao_s023"
      },
      "rollout": "rollouts/consulta_sucesso_preparo_falha.jsonl",
      "sha256_adjudicacoes": "f707d0aeaf54f0c82de372ec2d46a97393ff0a1417ddf237404cf124ace043e8",
      "sha256_gabarito": "e3fb83d8b25c33042f39e596c68b2bf62ef123ed02403ad39c0a55451f7e340f",
      "sha256_rollout": "7950f9a0f64595d958d19acc087114e6a29eb324818185f80da8ceaa0abebd64",
      "tags": [
        "metamorfico",
        "falha_mista",
        "s023"
      ]
    },
    {
      "adjudicacoes": "config/adjudicacoes.json",
      "case_id": "preparo_falha_consulta_sucesso",
      "conjunto": "desenvolvimento",
      "descricao": "Consulta bem-sucedida e preparo falho com resultados permutados.",
      "gabarito": "gabaritos/preparo_falha_consulta_sucesso.json",
      "origem": {
        "referencias_s023": [
          "call_GWDmUBmgUOS5GB4p7lJNzijy"
        ],
        "tipo": "reducao_s023"
      },
      "rollout": "rollouts/preparo_falha_consulta_sucesso.jsonl",
      "sha256_adjudicacoes": "f707d0aeaf54f0c82de372ec2d46a97393ff0a1417ddf237404cf124ace043e8",
      "sha256_gabarito": "6273c02079cd15fc84c7d01310333cffab52ea8e059c5baa3f7a33768c878a6b",
      "sha256_rollout": "5eb6f2fdf5bafd5282024c766e7884026571f21cd96663fcb39dd6c83d3f06a7",
      "tags": [
        "metamorfico",
        "falha_mista",
        "s023"
      ]
    },
    {
      "adjudicacoes": "config/adjudicacoes.json",
      "case_id": "lote_recusado_com_leitura",
      "conjunto": "desenvolvimento",
      "descricao": "Redução sintética do lote recusado que o envelope promoveu a sucesso.",
      "gabarito": "gabaritos/lote_recusado_com_leitura.json",
      "origem": {
        "referencias_s023": [
          "call_6fB4Boykl7e7xBOiqQUZEIg4"
        ],
        "tipo": "reducao_s023"
      },
      "rollout": "rollouts/lote_recusado_com_leitura.jsonl",
      "sha256_adjudicacoes": "f707d0aeaf54f0c82de372ec2d46a97393ff0a1417ddf237404cf124ace043e8",
      "sha256_gabarito": "af716782d500e54fff714905f1975c15a7d9353cd563ff42b0e22828fb69299a",
      "sha256_rollout": "19401a6289a8aa5f1e5dcd3e7e8f5e205f810751167448e60d78e127b2f399d6",
      "tags": [
        "falha_mista",
        "s023"
      ]
    },
    {
      "adjudicacoes": "config/adjudicacoes.json",
      "case_id": "encerramento_falho_com_leitura",
      "conjunto": "desenvolvimento",
      "descricao": "Redução sintética do encerramento falho misturado a leituras.",
      "gabarito": "gabaritos/encerramento_falho_com_leitura.json",
      "origem": {
        "referencias_s023": [
          "call_ZL43KEjr4YfRKBILc6zcwb9k"
        ],
        "tipo": "reducao_s023"
      },
      "rollout": "rollouts/encerramento_falho_com_leitura.jsonl",
      "sha256_adjudicacoes": "f707d0aeaf54f0c82de372ec2d46a97393ff0a1417ddf237404cf124ace043e8",
      "sha256_gabarito": "55c116f82b3b9fca83308f3711695dbdb1214c9e52e2ee5e467697b11ef92589",
      "sha256_rollout": "429672fb7cf2604ee4163f2b7463e4be5bb36a8aa5debb9417dc96a0e1ad0f9b",
      "tags": [
        "falha_mista",
        "s023"
      ]
    },
    {
      "adjudicacoes": "config/adjudicacoes.json",
      "case_id": "resultado_fragmentado",
      "conjunto": "desenvolvimento",
      "descricao": "Resultado final após sinal intermediário pertence à mesma chamada.",
      "gabarito": "gabaritos/resultado_fragmentado.json",
      "origem": {
        "referencias_s023": [],
        "tipo": "sintetico"
      },
      "rollout": "rollouts/resultado_fragmentado.jsonl",
      "sha256_adjudicacoes": "f707d0aeaf54f0c82de372ec2d46a97393ff0a1417ddf237404cf124ace043e8",
      "sha256_gabarito": "0a41f50844f1bb55dfa18d985387ecc9bdea294ecd507244ec78b44b48826af3",
      "sha256_rollout": "053d5e0e3b64fe6d24aa9ae422ceb6595abb9e9faed8d96d9c22272ae6aefcea",
      "tags": [
        "fragmento"
      ]
    },
    {
      "adjudicacoes": "config/adjudicacoes.json",
      "case_id": "resultado_retransmitido",
      "conjunto": "desenvolvimento",
      "descricao": "Retransmitir o resultado da primeira chamada não conclui a segunda.",
      "gabarito": "gabaritos/resultado_retransmitido.json",
      "origem": {
        "referencias_s023": [],
        "tipo": "sintetico"
      },
      "rollout": "rollouts/resultado_retransmitido.jsonl",
      "sha256_adjudicacoes": "f707d0aeaf54f0c82de372ec2d46a97393ff0a1417ddf237404cf124ace043e8",
      "sha256_gabarito": "1225e588f4f9f5c4871aa9342fcf301ef3bc71c822b1e7db1f783a277ca3eefe",
      "sha256_rollout": "ac5949fd85c86b6cf30d031aad8991d4b9e0c1435d09ce016e6dafb47d68ed67",
      "tags": [
        "retransmissao"
      ]
    },
    {
      "adjudicacoes": "config/adjudicacoes.json",
      "case_id": "comando_apenas_citado",
      "conjunto": "desenvolvimento",
      "descricao": "Comando e recibos citados não representam execução.",
      "gabarito": "gabaritos/comando_apenas_citado.json",
      "origem": {
        "referencias_s023": [],
        "tipo": "sintetico"
      },
      "rollout": "rollouts/comando_apenas_citado.jsonl",
      "sha256_adjudicacoes": "f707d0aeaf54f0c82de372ec2d46a97393ff0a1417ddf237404cf124ace043e8",
      "sha256_gabarito": "b568c64896be47130cc0630e6fa4b154fb3106962537c7767a394e90ea879e75",
      "sha256_rollout": "6fa0b4baaae0d131f0d40a442c3c4cddaadb6d685a585f92909309f430a5b769",
      "tags": [
        "citacao",
        "controle"
      ]
    },
    {
      "adjudicacoes": "config/adjudicacoes.json",
      "case_id": "preparo_sem_recibos",
      "conjunto": "desenvolvimento",
      "descricao": "Preparo concluído sem recibos gera ausência real.",
      "gabarito": "gabaritos/preparo_sem_recibos.json",
      "origem": {
        "referencias_s023": [],
        "tipo": "sintetico"
      },
      "rollout": "rollouts/preparo_sem_recibos.jsonl",
      "sha256_adjudicacoes": "f707d0aeaf54f0c82de372ec2d46a97393ff0a1417ddf237404cf124ace043e8",
      "sha256_gabarito": "f32a75d880f8b727bb0f897ceb9a007ceecf289f0a98e9ce7313c90e85dce259",
      "sha256_rollout": "0ced788c66ad51b814be94871a7e7ccf160b3d592e636ef4a202f28a9c55649d",
      "tags": [
        "ausencia",
        "controle"
      ]
    },
    {
      "adjudicacoes": "config/adjudicacoes.json",
      "case_id": "resultado_ausente",
      "conjunto": "desenvolvimento",
      "descricao": "Chamada sem resultado não fabrica sucesso.",
      "gabarito": "gabaritos/resultado_ausente.json",
      "origem": {
        "referencias_s023": [],
        "tipo": "sintetico"
      },
      "rollout": "rollouts/resultado_ausente.jsonl",
      "sha256_adjudicacoes": "f707d0aeaf54f0c82de372ec2d46a97393ff0a1417ddf237404cf124ace043e8",
      "sha256_gabarito": "b6878a2c5706fa5d5d06bb634e40f92e11d0f07c4c7a4ca2bbad50084fd047d7",
      "sha256_rollout": "e5202143db95686053b17e58d31659a605872ef690e93fccda5bbb0ae861d2bb",
      "tags": [
        "evidencia_ausente"
      ]
    },
    {
      "adjudicacoes": "config/adjudicacoes.json",
      "case_id": "retry_sem_efeito_duplicado",
      "conjunto": "desenvolvimento",
      "descricao": "Retry de memória conserva exactly-once.",
      "gabarito": "gabaritos/retry_sem_efeito_duplicado.json",
      "origem": {
        "referencias_s023": [],
        "tipo": "sintetico"